{
  "schema_version": 1,
  "catalog_hash": "2b976456d5149217a7b3513f036650e3caed35e3d7067781e3b65132b6d5f4e1",
  "id": "JW-LTBF-08",
  "sequence": 8,
  "title": "高位压迫近景",
  "status": "scheduled",
  "status_label": "待排期",
  "scene": "宴席室内",
  "shot_scale": "俯视近景",
  "tags": [
    "俯视",
    "压迫",
    "近景"
  ],
  "source": {
    "frame_id": "LTBF-08",
    "file_label": "08_overhead_pressure_closeup.jpg",
    "source_type": "第一轮筛选",
    "timecode": "00:49:30（文件名定位）",
    "evidence_status": "精确帧位待核",
    "summary": "高位机位与人物近景形成压迫关系。"
  },
  "hypothesis": "高位机位、头部比例和周边空间压缩能否稳定产生压迫，而不是变成普通俯拍肖像。",
  "methods": [
    {
      "id": "A",
      "label": "Camera Height",
      "intent": "计划测试机位高度。"
    },
    {
      "id": "B",
      "label": "Compression",
      "intent": "计划测试空间压缩。"
    },
    {
      "id": "C",
      "label": "Expression",
      "intent": "计划测试表情与构图关系。"
    }
  ],
  "result_summary": "尚未测试；当前只完成母图入图谱和来源边界记录。",
  "conclusion": "没有实验结论。",
  "next_step": "核验镜头前后动作和真实空间，再建立测试。",
  "prompt_changes": [],
  "findings": [],
  "failures": [],
  "document_id": null,
  "images": {
    "source": "assets/works/mirror-plan/research/atlas/08.jpg",
    "variants": []
  },
  "stats": {
    "round_count": 0,
    "prompt_count": 0,
    "image_count": 0,
    "document_count": 0
  },
  "updated_at": "2026-07-28"
}
