{
  "schema_version": 1,
  "catalog_hash": "2b976456d5149217a7b3513f036650e3caed35e3d7067781e3b65132b6d5f4e1",
  "id": "JW-LTBF-06",
  "sequence": 6,
  "title": "道具与人物关系近景",
  "status": "scheduled",
  "status_label": "待排期",
  "scene": "室内争执",
  "shot_scale": "道具近景",
  "tags": [
    "道具叙事",
    "人物关系"
  ],
  "source": {
    "frame_id": "LTBF-06",
    "file_label": "06_target_prop_closeup.jpg",
    "source_type": "第一轮筛选",
    "timecode": "01:04:30（文件名定位）",
    "evidence_status": "精确帧位待核",
    "summary": "道具与人物关系近景。"
  },
  "hypothesis": "道具的尺度、手部动作和人物视线能否共同承担争执信息，而不是把道具做成孤立产品特写。",
  "methods": [
    {
      "id": "A",
      "label": "Blocking",
      "intent": "计划测试人物与道具位置。"
    },
    {
      "id": "B",
      "label": "Material",
      "intent": "计划测试道具材质与年代感。"
    },
    {
      "id": "C",
      "label": "Reaction",
      "intent": "计划测试视线与反应关系。"
    }
  ],
  "result_summary": "尚未测试；当前只完成母图入图谱和来源边界记录。",
  "conclusion": "没有实验结论。",
  "next_step": "补齐精确时间码和原片证据卡，再建立 A/B/C Prompt。",
  "prompt_changes": [],
  "findings": [],
  "failures": [],
  "document_id": null,
  "images": {
    "source": "assets/works/mirror-plan/research/atlas/06.jpg",
    "variants": []
  },
  "stats": {
    "round_count": 0,
    "prompt_count": 0,
    "image_count": 0,
    "document_count": 0
  },
  "updated_at": "2026-07-28"
}
