{
  "schema_version": 1,
  "catalog_hash": "2b976456d5149217a7b3513f036650e3caed35e3d7067781e3b65132b6d5f4e1",
  "id": "JW-LTBF-14",
  "sequence": 14,
  "title": "马匹进入院落到达画面",
  "status": "scheduled",
  "status_label": "待补证 · 待排期",
  "scene": "院落到达",
  "shot_scale": "多人全景",
  "tags": [
    "马匹",
    "院落",
    "到达"
  ],
  "source": {
    "frame_id": "LTBF-14",
    "file_label": "14_horse_courtyard_arrival_screenshot.png",
    "source_type": "人工补图",
    "timecode": "待补",
    "evidence_status": "带播放器界面；片段与精确时间码待补",
    "summary": "马匹、院落入口和人物队列构成到达场面。"
  },
  "hypothesis": "马匹解剖、入口轴线和队列层级能否共同建立到达事件，并与 05 的权力空间形成对照。",
  "methods": [
    {
      "id": "A",
      "label": "Anatomy",
      "intent": "计划测试马匹解剖。"
    },
    {
      "id": "B",
      "label": "Arrival",
      "intent": "计划测试到达动作。"
    },
    {
      "id": "C",
      "label": "Power Space",
      "intent": "计划测试入口权力空间。"
    }
  ],
  "result_summary": "尚未测试；母图带播放器界面，来源证据还不完整。",
  "conclusion": "没有实验结论。",
  "next_step": "重截干净母图，补齐时间码，并与 JW-LTBF-05 建立对照假设。",
  "prompt_changes": [],
  "findings": [],
  "failures": [],
  "document_id": null,
  "images": {
    "source": "assets/works/mirror-plan/research/atlas/14.jpg",
    "variants": []
  },
  "stats": {
    "round_count": 0,
    "prompt_count": 0,
    "image_count": 0,
    "document_count": 0
  },
  "updated_at": "2026-07-28"
}
