{
  "schema_version": 1,
  "catalog_hash": "2b976456d5149217a7b3513f036650e3caed35e3d7067781e3b65132b6d5f4e1",
  "id": "JW-LTBF-10",
  "sequence": 10,
  "title": "火车车厢宴席画面",
  "status": "scheduled",
  "status_label": "待补证 · 待排期",
  "scene": "车厢室内",
  "shot_scale": "群像全景",
  "tags": [
    "车厢",
    "宴席",
    "封闭空间"
  ],
  "source": {
    "frame_id": "LTBF-10",
    "file_label": "10_train_carriage_banquet_screenshot.png",
    "source_type": "人工补图",
    "timecode": "待补",
    "evidence_status": "带播放器界面；片段与精确时间码待补",
    "summary": "车厢宴席中的封闭群像关系。"
  },
  "hypothesis": "狭长车厢、桌面与人物排列能否同时表达封闭空间和宴席秩序。",
  "methods": [
    {
      "id": "A",
      "label": "Space",
      "intent": "计划测试车厢空间。"
    },
    {
      "id": "B",
      "label": "Table",
      "intent": "计划测试桌面轴线。"
    },
    {
      "id": "C",
      "label": "Ensemble",
      "intent": "计划测试群像层级。"
    }
  ],
  "result_summary": "尚未测试；母图带播放器界面，来源证据还不完整。",
  "conclusion": "没有实验结论。",
  "next_step": "重截干净母图并补齐片段与时间码。",
  "prompt_changes": [],
  "findings": [],
  "failures": [],
  "document_id": null,
  "images": {
    "source": "assets/works/mirror-plan/research/atlas/10.jpg",
    "variants": []
  },
  "stats": {
    "round_count": 0,
    "prompt_count": 0,
    "image_count": 0,
    "document_count": 0
  },
  "updated_at": "2026-07-28"
}
