{
  "schema_version": 1,
  "catalog_hash": "2b976456d5149217a7b3513f036650e3caed35e3d7067781e3b65132b6d5f4e1",
  "id": "JW-LTBF-12",
  "sequence": 12,
  "title": "目标人物面部近景",
  "status": "scheduled",
  "status_label": "待补证 · 待排期",
  "scene": "人物反应",
  "shot_scale": "面部特写",
  "tags": [
    "面部",
    "反应",
    "视线"
  ],
  "source": {
    "frame_id": "LTBF-12",
    "file_label": "12_target_face_closeup_screenshot.png",
    "source_type": "人工补图",
    "timecode": "待补",
    "evidence_status": "带播放器界面；片段与精确时间码待补",
    "summary": "人物面部、视线和皮肤层次构成反应特写。"
  },
  "hypothesis": "脸内反差、视线和细微表情能否成立，同时避免生成式人物的塑料化和明星脸偏移。",
  "methods": [
    {
      "id": "A",
      "label": "Expression",
      "intent": "计划测试细微表情。"
    },
    {
      "id": "B",
      "label": "Skin",
      "intent": "计划测试肤质与脸内反差。"
    },
    {
      "id": "C",
      "label": "Gaze",
      "intent": "计划测试画外视线。"
    }
  ],
  "result_summary": "尚未测试；母图带播放器界面，来源证据还不完整。",
  "conclusion": "没有实验结论。",
  "next_step": "重截干净母图并补齐画外关系证据。",
  "prompt_changes": [],
  "findings": [],
  "failures": [],
  "document_id": null,
  "images": {
    "source": "assets/works/mirror-plan/research/atlas/12.jpg",
    "variants": []
  },
  "stats": {
    "round_count": 0,
    "prompt_count": 0,
    "image_count": 0,
    "document_count": 0
  },
  "updated_at": "2026-07-28"
}
