{
  "schema_version": 1,
  "catalog_hash": "2b976456d5149217a7b3513f036650e3caed35e3d7067781e3b65132b6d5f4e1",
  "id": "JW-LTBF-07",
  "sequence": 7,
  "title": "长桌群像与权力秩序",
  "status": "scheduled",
  "status_label": "待排期",
  "scene": "室内群像",
  "shot_scale": "多人全景",
  "tags": [
    "长桌",
    "群像",
    "权力秩序"
  ],
  "source": {
    "frame_id": "LTBF-07",
    "file_label": "07_long_table_group_power.jpg",
    "source_type": "第一轮筛选",
    "timecode": "01:04:30（文件名定位）",
    "evidence_status": "精确帧位待核",
    "summary": "长桌、人物距离与座次构成权力秩序。"
  },
  "hypothesis": "座次、距离和桌面轴线能否在不依赖人物身份标签时建立群像权力关系。",
  "methods": [
    {
      "id": "A",
      "label": "Axis",
      "intent": "计划测试桌面和摄影机轴线。"
    },
    {
      "id": "B",
      "label": "Hierarchy",
      "intent": "计划测试座次和体量层级。"
    },
    {
      "id": "C",
      "label": "Depth",
      "intent": "计划测试群像景深。"
    }
  ],
  "result_summary": "尚未测试；当前只完成母图入图谱和来源边界记录。",
  "conclusion": "没有实验结论。",
  "next_step": "核对连续镜头中的座次与动作，再建立单变量测试。",
  "prompt_changes": [],
  "findings": [],
  "failures": [],
  "document_id": null,
  "images": {
    "source": "assets/works/mirror-plan/research/atlas/07.jpg",
    "variants": []
  },
  "stats": {
    "round_count": 0,
    "prompt_count": 0,
    "image_count": 0,
    "document_count": 0
  },
  "updated_at": "2026-07-28"
}
